video_id,title,rating_view,rating_comments,rating_good,published_date,description
IGfab2cjY4k,까르보 불닭 리조또,2194174,453,64222,2023-06-18T12:00:20Z,더 강한 불닭리조또가 나왔다. #불닭리조또 #불닭볶음면 #불닭레시피 #불닭 #까르보불닭 #buldak #buldakrisotto.
yEHZ5QORy8M,불닭볶음면을 가장 완벽하게 만드는 법,10565661,2421,193928,2023-06-02T11:00:51Z,60계치킨 #크크크치킨.
tNQMFzUx2Rg,불닭볶음면의 숨겨진 비밀 #shorts,4259848,793,91018,2023-06-07T09:45:02Z,불닭볶음면의 숨겨진 비밀 #shorts #불닭볶음면 #먹방.
JnVu_haMWBc,까르보불닭 맛있게 먹기 전에 해야하는 일 #shorts,327478,130,5142,2023-06-26T08:18:54Z,인스타그램 https://www.instagram.com/min_a70618/ ♡babybaby12312332@gmail.com Hi everyone! This is Min-a 여러분 안녕 ...
AmRmkPpbmJw,불닭 제일 매운 단계 할라피뇨 불닭볶음면 딱 한 봉지 속성 먹방,2683976,492,66949,2023-06-17T08:12:30Z,mukbang #asmr #food #먹방브이로그 #먹방 #할라피뇨불닭볶음면.
SYan5RNcRBY,"하루 동안 불닭만 10,000칼로리 먹기!! 불닭 음식 다 먹어봤다!! 매운맛 대폭발!!!",772051,760,5194,2023-06-12T09:00:26Z,늦기 전에 효도합시다!! 좋아요와 구독은 박씨집안에게 큰 힘이 됩니다. ʚ♡⃛ɞ 딸내미 유진 인스타그램 ...
jJZLEzWeef4,불닭 팽이버섯 30배 맛있게 먹는 법,2808103,624,64250,2023-06-06T08:30:20Z,
UarTQAGp1bs,맵찔이 뚜지의 첫 불닭볶음면 도전?!?! 일본판과 한국판 어떤게 더 매울까요? 비교해서 먹어봤어요!!! 가족일상 브이로그 | 뚜아뚜지TV,99773,423,1407,2023-06-03T23:00:09Z,불닭볶음면 #먹방 #라면 뚜아뚜지 인스타그램 : https://www.instagram.com/sua_suji 뚜아뚜지TV는 가족이 함께하는 패밀리채널 ...
LbtehYnn2No,"ASMR 불닭볶음면 타코야끼 이 조합 찬성일세😆👍🏻 리얼먹방 :) Buldak stir-fried noodles, Takokayki MUKBANG",1141192,480,15384,2023-06-23T10:00:26Z,안녕하세요아미입니다 저는 평균적으로 먹는 속도가 30분~1시간 입니다 영상을 10분~15분으로 만들다 보니 먹는 도중 음식이 ...
TYhehCCXuAM,불닭소스 30인분으로 생면파스타 뽑기,3238373,1388,31557,2023-06-11T12:15:01Z,불닭 노른자장으로 반죽한 생면 [불닭 생면 파스타] 1) 불닭소스에 계란 노른자를 30개 넣는다 2) 하룻동안 노른자를 숙성한다 3) ...
r3Y_oMrpEQY,불닭볶음면 국물버전 5년의 기다림은 헛되지 않았쥬?,944068,210,22726,2023-06-15T11:00:39Z,흑백리뷰 #스케치코미디 #shorts 불닭볶음탕면 리뷰.
Hyb5tZTsR-o,신제품 할라피뇨 치즈불닭볶음면을 조심해야 되는 이유 #shorts,891871,173,17407,2023-06-16T14:07:12Z,집가락 정품 구매하는 곳 홍사운드몰 https://hongsound.shop/ 네이버 ...
IWL7REiGKV8,살 빠지는 불닭 크림 리조또,327224,68,14013,2023-06-21T14:00:55Z,다이어트식단 #다이어트레시피 #다이어터 #koreandiet #다이어트 #오트밀죽 #불닭소스 #리조또 #유지어터 #koreanfoodlover ...
dct9uBpiFMA,1분에 불닭라면 800개씩…&quot;올해 매출 1조&quot;/한국경제TV뉴스,7873,16,108,2023-06-22T10:29:11Z,삼양식품의 매운라면 '붉닭시리즈'가 누적 판매량 46억 개를 돌파했습니다. 삼양식품은 K-라면의 전진기지인 밀양공장의 가동률을 ...
I5thepUWbiE,한국 불닭볶음면 vs 일본 볶음면 비교 먹방,1149509,420,11911,2023-06-27T10:00:14Z,관련 영상 •한국과자와 일본과자 비교하기 (with 공혁준): https://youtu.be/jnJ88ye1rYs ▷관련 재생목록 •침착맨의 식욕저하 다이어트 ...
CjcZxN3QXa8,불닭볶음탕면은 무조건 이거랑 드세요,1565361,288,34180,2023-06-30T08:00:06Z,간장계란밥 #먹방.
ijBM34XjcWM,불닭볶음면 신제품 불닭볶음탕면 5년만에 돌아왔다,430074,459,5181,2023-06-05T08:00:29Z,흑백리뷰 #스케치코미디 #라면 불닭볶음탕면 먹방.
q8BMZmOSRz0,불닭을 이렇게 먹어본 사람?,1187231,211,30057,2023-06-03T07:06:08Z,불닭 이렇게 먹으면 못 끊습니다 #용디쇼츠.
J_gE_CnSjxA,이게 맛있다고? 재출시된 불닭볶음탕면과 가장 맛있는 조합 찾기!!,1998793,341,47827,2023-06-30T10:59:21Z,ㅡDDO HO⭐ ♬HO INSTAGRAM | https://www.instagram.com/ddo.ho ㅡ ddo_ho@sandboxnetwork.net ㅡ #불닭볶음면 #불닭 ...
lb4NonV-bus,우리가 불닭납작당면을 매일 먹고 싶은 이유 Buldak Spicy Noodles,24934656,1023,955317,2023-06-11T13:06:16Z,불닭볶음면 #납작당면 #학생밥 #buldak #spicynoodles #studentmeals #studentrecipes #easyrecipe #fyp #viral.
j2Pkfn3q2IM,과연 불닭소스 솜사탕을 만들 수 있을까?,3696092,624,82993,2023-06-11T08:10:00Z,쇼츠 #shorts.
dq7GSyUz-RA,불닭볶음탕면 컴백 영상 #shorts,749352,262,-1,2023-06-20T09:02:22Z,자취브이로그 #자취요리 #다이어트 #먹방브이로그 #불닭볶음면 #불닭볶음탕면 #삼양.
JZ7mPHHEOcc,응룡갑의 통대창 1kg 불닭쌈 먹방! Daechang &amp; Buldak Eating show MUKBANG ASMR,1121334,415,9773,2023-06-13T13:15:00Z,통대창 #한우 #소대창 #불닭쌈 오늘은 촬영권을 이용하여~ 응룡갑 먹방을 찍어보았습니다~ 비주얼 끝장나는 대창과 불닭쌈 먹방~ ...
f1kMYZ9cToc,요새 누가 70cm먹방해 80cm 먹방하지…🤤 불닭 까르보 자메이카 속성먹방 #80cmmukbang,2403097,365,63181,2023-06-06T07:21:59Z,mukbang #asmr #eatingsound #asmr #korea #spicy.
Y_zU1gg7rto,5년만에 돌아온 불닭볶음탕면 ㄷㄷ 저는 포기합니다,44518,27,538,2023-06-21T08:00:56Z,
n3LPu08afwU,북한에서 몰래 핵불닭볶음면 먹는 북한남자 장명진,4657,64,303,2023-06-19T13:00:40Z,반갑습니다 동무들 ! 영상 재미있게 보셨다면 좋아요와 구독 눌러주세요 댓글은 늘 감사합니다 ♥ 인스타: teng_go_youtube 메일: ...
MiCpfP6B2GU,콘치즈 불닭 김밥 ❤️‍🔥❤️‍🔥❤️‍🔥 #shorts,6388,6,193,2023-06-11T12:33:07Z,
e8CxpAqLlkg,유튜브 매운맛 최강자의 불닭 12단계 서열 정리 매뉴얼,205001,405,3162,2023-06-17T11:00:34Z,고정 댓글을 참고해주세요:-) --------------------------------------------------------------------- 경원 인스타그램 ☞ woney2ny 재영 인스타그램 ...
ys_U39poTAk,#불닭볶음면 에  #불닭마요 섞어먹으면 속 편하게 매워요~!  #buldakramen #,12151,4,77,2023-06-11T14:54:11Z,"불닭소스 2/3, 불닭마요소스 두바퀴 취향에 따라 설탕 1/2T 넣어도 맛있어요~~!! #cooking #cookingvideo #cookingram #cookingtime ..."
rtqlMoPBX0o,5년만에 개같이 부활… 불닭볶음탕면 드디어 먹었습니다,61121,12,884,2023-06-27T08:18:26Z,불닭볶음탕면 #shorts #리뷰 #편의점 #불닭볶음면 #불닭볶음탕면 #라면 #신상 #내돈내산 #신상리뷰 #제품리뷰.
ZE6JpP8Ljfs,많이 기다렸다.. 드디어 나온 불닭볶음탕면 #shorts,679873,96,-1,2023-06-09T11:30:10Z,
qRaRBvxm9SQ,빨강 불닭 계란,900975,165,22894,2023-06-13T08:00:20Z,불닭이 계란과 만났을 때 #용디쇼츠.
2TwoUvkJ4ts,SUB)야끼소바 불닭볶음면에 바삭두툼 치즈돈까스 새우튀김 먹방! 라면 꿀조합 리얼사운드 Buldak Yakisoba Mukbang Asmr,1958700,395,30046,2023-06-18T11:00:01Z,"각국어 번역 자막 제작 : 컨텐츠 제작의 마무리는 컨텐츠플라이! 글로벌 진출을 위한 최고의 파트너, CONTENTSFLY에서 제작 ..."
MIFL14Y8seY,불닭볶음면에 초코렛 부어먹으면 맛있다고!? 안매워!? [괴식재판소 12탄],249535,640,17234,2023-06-29T07:30:06Z,오랜만에 돌아온 슈뻘맨의 괴식재판소 12탄!!! 오늘은 과연 어떤 괴식들이 우릴 기다리고 있을까..?! 불닭볶음면에.. 초코렛..?! 이건 ...
IqvXnOabY08,불닭볶음탕면 드디어 먹어봤습니다!!😖🔥 치즈 넣고 볶음밥까지 만들어 먹었다구!! 초당옥수수 + 각종디저트✨,403358,262,5244,2023-06-26T10:31:00Z,채널구독 Subscribe - http://bit.ly/1NhqAO6 ❤ instagram - https://instagram.com/sini_ck ❤멤버십 가입 ...
y-05sFl7LmQ,불닭비빔면 역대급 레전드 먹방 리뷰,210369,350,3318,2023-06-27T08:00:32Z,흑백리뷰 #스케치코미디 #편의점 세븐일레븐 타코야끼 불닭비빔면 리뷰.
D9p7f6EcxAU,buldak bokkeum myeon and spam kimchi fried rice together #asmr #koreanfood,48179,17,4749,2023-06-21T13:30:34Z,asmr #conveniencestore #buldak #kimchifriedrice #shorts.
BFjQT95h4_A,신제품 불닭볶음탕면 맛있게 먹는 꿀팁,26640,57,531,2023-06-13T03:03:00Z,금휘 트위치 - https://www.twitch.tv/goldhwi 금휘 인스타 - https://www.instagram.com/goldhwi_/ 생방송은 오후 4시! #불닭볶음탕면 ...
PCURvqYwtM8,킬바사+불닭볶음면 개 맛있음,2144834,491,52107,2023-06-19T08:00:07Z,가끔은 저도 제가 무슨 말을 하는지 모르겠지만 괜찮아요.
n62YYw1-4eA,(ASMR) 치즈 불닭볶음탕면 통대창 먹방 ❤️‍🔥,1171654,817,19276,2023-06-18T12:00:37Z,치즈 불닭볶음탕면 통대창 먹방 ASMR 상윤쓰 인스타그램 : https://www.instagram.com/SANGYOONCE ...
j0joJRuSaB4,5년 존버 성공 재출시된 불닭볶음탕면 딱 한봉지 속성 먹방  #50cmmukbang,1365510,260,31982,2023-06-27T07:42:33Z,mukbang #asmr #eatingsound #shorts.
hOOckpo_oak,ASMR MUKBANG| 직접 만든 불닭볶음면 특집 먹방 &amp; 레시피 FIRE NOODLES EATING,7097492,1100,41328,2023-06-09T12:30:18Z,"먹방 #ASMR #MUKBANG #합방 #불닭볶음면먹방 합동 방송 및 광고, 협찬 문의는 아래 메일로 연락해주세요 :) 비즈니스메일 ..."
-WWGdLup_2A,새벽에 부모님 앞에서 불닭 먹기 #shorts,2404289,587,67677,2023-06-20T11:25:47Z,
_4EMhVyyfXA,대창과 불닭볶음탕면,711248,212,9928,2023-06-17T12:17:31Z,구매처:자미곱 (여기는 시청자분들과 저와의 소통공간입니다.)
qhzsZ487yTM,일본에서만 판매하는 불닭 야끼소바ㄷㄷ,123121,236,2613,2023-06-18T06:00:14Z,멤버쉽 가입 감사합니다! https://url.kr/ytuci4 ------------------------------------------------------------------- 유튜브 : https://goo.gl/qLb7as ...
nVaA4jO4nXo,드뎌 국내 재출시한 불닭볶음탕면ㅠㅠ,311740,39,9328,2023-06-12T09:00:33Z,불닭볶음면 #불닭 #불닭볶음탕면 #먹방 #오늘뭐먹지 #쇼츠.
jgNIsE7yY6w,"아기자기한 취향과 그렇지 못한 식욕 / 도미노피자 + 불닭볶음면 / 아웃백 양송이스프, 맥모닝, 돈까스김치전골",537592,681,7637,2023-06-01T13:47:29Z,집밥브이로그#요리브이로그#일상브이로그 instagram : http://www.instagram.com/hhhongsiii 비지니스 메일 ...
fZtgiRJt8tA,"EP164 삼양 할라피뇨치즈불닭볶음면,불닭볶음면",306,6,-1,2023-06-23T23:57:29Z,할라피뇨치즈불닭볶음면 #불닭볶음면 #할라피뇨치즈 #할라피뇨 #이국적인매운맛 소통해요.
cVge85S5c6s,불닭마요 들기름 막국수,13101,1,188,2023-06-07T10:15:01Z,shorts Music provided by 브금대통령 Track : 알쏭달쏭 - https://www.youtube.com/watch?v=Q_F3O2h0xrg&t=8s.
Ei7PF7m6JaM,how to make buldak soup cup ramen with cheese #asmr #koreanfood,1305967,81,72751,2023-06-16T12:45:26Z,asmr #conveniencestore #koreanfood #shorts #buldak.
ivyfeml-vM8,Mukbang Giant Fire Spicy Noodle&amp;Giant Fried Chicken 하이유의 대왕 불닭볶음면 할라피뇨치즈 대왕 갈릭 치킨 먹방 | HIU 하이유,2304539,242,10632,2023-06-01T07:00:17Z,하이유가 헤이유의 음식을 크게 만들었어요! 하이유의 거대 할라피뇨 치즈 불닭볶음면 & 대왕 BBQ바삭갈릭치킨 먹방! HIU made ...
wr8em-aU0i4,(요리툰) 가장 맛있는 불닭 조합?? #애니메이션,697252,873,19725,2023-06-25T08:45:03Z,요리 #불닭볶음면 불닭매력대회!! 최강의 불닭 레시피는?? 안녕하십니까 전 불끈불끈 불닭입니다 불끈불닭씨의 매력은 모죠!! 제 물건 ...
D9p7f6EcxAU,buldak bokkeum myeon and spam kimchi fried rice together #asmr #koreanfood,48179,17,4749,2023-06-21T13:30:34Z,asmr #conveniencestore #buldak #kimchifriedrice #shorts.
eFKvxY0tKiU,이국적인 매운맛의 🔥 불닭신상! 할라피뇨치즈불닭볶음면 🍜 맵지만 너무 맛있어 😋,368,69,34,2023-06-23T14:30:09Z,불닭신상#불닭볶음면#할라피뇨치즈불닭볶음면 오늘은 불닭신상! 할라피뇨치즈 불닭볶음면을 먹어 봤어요 매콤 쌉쌀한 할라피뇨 ...
2TwoUvkJ4ts,SUB)야끼소바 불닭볶음면에 바삭두툼 치즈돈까스 새우튀김 먹방! 라면 꿀조합 리얼사운드 Buldak Yakisoba Mukbang Asmr,1958700,395,30046,2023-06-18T11:00:01Z,"각국어 번역 자막 제작 : 컨텐츠 제작의 마무리는 컨텐츠플라이! 글로벌 진출을 위한 최고의 파트너, CONTENTSFLY에서 제작 ..."
Gg6-OVi7HPs,해외에서만 판다는 불닭야끼소바 후기?!,29381,8,455,2023-06-07T09:30:03Z,저희는 방콕에서 구매했습니다✈️ . . #야끼소바불닭볶음면 #불닭야끼소바 #불닭 #불닭볶음면 #불닭볶음면신상 #방콕여행 #먹방.
aQ4q2GoXBcY,불닭볶음면,2099,1,25,2023-06-09T06:57:01Z,
5hZH0teZ6Wo,불닭볶음면과 사랑에 빠진 여자,1266,9,46,2023-06-24T02:41:12Z,
y-05sFl7LmQ,불닭비빔면 역대급 레전드 먹방 리뷰,210369,350,3318,2023-06-27T08:00:32Z,흑백리뷰 #스케치코미디 #편의점 세븐일레븐 타코야끼 불닭비빔면 리뷰.
IqvXnOabY08,불닭볶음탕면 드디어 먹어봤습니다!!😖🔥 치즈 넣고 볶음밥까지 만들어 먹었다구!! 초당옥수수 + 각종디저트✨,403358,262,5244,2023-06-26T10:31:00Z,채널구독 Subscribe - http://bit.ly/1NhqAO6 ❤ instagram - https://instagram.com/sini_ck ❤멤버십 가입 ...
n62YYw1-4eA,(ASMR) 치즈 불닭볶음탕면 통대창 먹방 ❤️‍🔥,1171654,817,19276,2023-06-18T12:00:37Z,치즈 불닭볶음탕면 통대창 먹방 ASMR 상윤쓰 인스타그램 : https://www.instagram.com/SANGYOONCE ...
vDyTW1MUxmc,불닭쌈❤️,412,1,5,2023-06-16T12:49:39Z,인싸 레시피 리뷰! #불닭쌈     요즘 SNS에서 핫한 레시피!! 며칠 전 물회를 만들고 야채가 많이 남아서 남은 야채 털어볼겸 불닭쌈을 ...
BFjQT95h4_A,신제품 불닭볶음탕면 맛있게 먹는 꿀팁,26640,57,531,2023-06-13T03:03:00Z,금휘 트위치 - https://www.twitch.tv/goldhwi 금휘 인스타 - https://www.instagram.com/goldhwi_/ 생방송은 오후 4시! #불닭볶음탕면 ...
B6Ix4sGZ9Z8,[10분 간편안주 요리] 골뱅이 불닭 콘치즈 레시피,103,1,4,2023-06-26T14:52:41Z,협찬 #간단요리 #유동골뱅이 #골뱅이불닭콘치즈 #혼술안주 #안주추천 #골뱅이 #유동골뱅이 #골뱅이요리 #골뱅이레시피 #통조림 ...
suMs9BkFLpw,매콤한 불닭소스를 넣어보세요 맛있는 삼겹살 불닭볶음 레시피,1267,0,32,2023-06-16T10:00:43Z,
HZ5w1kqupBA,재출시된 불닭볶음탕면과 통대창 급식!! 맛있어서 행복해요!!!!!,2229769,434,55513,2023-06-29T10:45:28Z,ㅡDDO SOL❤️ ♪SOL INSTAGRAM | https://www.instagram.com/ddo.sol ㅡ ddo_sol@sandboxnetwork.net ㅡ #불닭 #불닭 ...
HUvwWMPlQDo,불닭 팽이쌈 (업그레이드 버전),1656,5,25,2023-06-28T23:16:28Z,곧 귀국할 워홀러가 냉장고와 펜트리를 비우기 위해 요리하는 이야기 업그레이드 버전 불닭 팽이버섯 쌈 #호주 #호주워홀 ...
iS-chWx4AcY,SNS를 뒤흔들 초간단 불닭만두덮밥🥟,5872,25,122,2023-06-06T11:16:24Z,상세 레시피는 고정 댓글을 참조 하세요. 냉동실에 남아있는 만두로 불닭만두덮밥을 만들어 보았습니다:) #자취요리 #초간단요리 ...
qhzsZ487yTM,일본에서만 판매하는 불닭 야끼소바ㄷㄷ,123121,236,2613,2023-06-18T06:00:14Z,멤버쉽 가입 감사합니다! https://url.kr/ytuci4 ------------------------------------------------------------------- 유튜브 : https://goo.gl/qLb7as ...
K03txFzmrNg,삼양 할라피뇨 치즈 불닭볶음면#shorts,591,0,7,2023-06-12T05:00:11Z,
pYSFZ-4xxT8,불닭 쿠지라이식,216490,48,6044,2023-06-23T10:00:41Z,맵찔이들도 먹을 수 있는 불닭 볶음면 쿠지라이식 불닭을 많이 맵게 느껴지는분들 많이 계시죠? 그런 분들을 위한 특급 레시피를 준비 ...
_4EMhVyyfXA,대창과 불닭볶음탕면,711248,212,9928,2023-06-17T12:17:31Z,구매처:자미곱 (여기는 시청자분들과 저와의 소통공간입니다.)
w3nFbSXUToc,Mukbang Fire Spicy Noodle Convenience Store 불닭볶음면 떡볶이 TV 속 편의점 음식 먹방 DONA 도나 animation,1052309,41,1673,2023-06-11T09:00:37Z,Subscribes and likes are so good for my cat❤️ Mukbang Fire Spicy Noodle Convenience Store 불닭볶음면 떡볶이 TV 속 편의점 ...
E4cVH8GDwxM,할라피뇨 치즈 불닭볶음면,714,0,14,2023-06-14T14:15:00Z,shorts #편의점 #불닭볶음면 #buldak #신상 #scoville #할라피뇨.
jgNIsE7yY6w,"아기자기한 취향과 그렇지 못한 식욕 / 도미노피자 + 불닭볶음면 / 아웃백 양송이스프, 맥모닝, 돈까스김치전골",537592,681,7637,2023-06-01T13:47:29Z,집밥브이로그#요리브이로그#일상브이로그 instagram : http://www.instagram.com/hhhongsiii 비지니스 메일 ...
q_MZg3epZBA,불닭치즈김밥의 위험,2173,4,-1,2023-06-14T06:38:56Z,
l-2FJeCih6g,미고랭x불닭볶음면 케미 폭발! 동남아 현지 느낌 물씬~,4240,1,16,2023-06-24T10:30:20Z,ramen #buldak #migoreng #indonesianfood #koreafood #noodles #불닭볶음면 #라면 #рамен #mì #miinstan #ラーメン #ราเมน.
rGmsV5l5yEE,짝퉁불닭볶음면먹어보기,1108,4,8,2023-06-08T10:50:07Z,
y7hLGqCKw9A,"몸무게 앞자리를 바꿀 천재적 아이디어, 피자 불닭쌈 Pizza Buldak Ssam",16319084,2020,568777,2023-06-06T13:13:40Z,불닭볶음면 #불닭쌈 #피자 #buldak #ramen #spicynoodles #pizza #fyp #viral.
NJxqefh7Ku4,불닭 어디까지 갈거니? (feat. 바질까지 간다) #쇼츠 #shorts #불닭볶음면,1676,1,25,2023-06-09T06:00:07Z,쇼츠 #shorts #불닭볶음면 안녕하세요? 오늘의 주제는 바질크림 불닭볶음면입니다. 다음 주제는 댓글로 남겨주세요. 그럼 이만.
-X-lmEqwa8M,핵불닭 맵기의 할라피뇨치즈 불닭볶음면 신제품 리얼사운드 먹방 feat.마무리송 | New nuclear Fire noodles Eatingshow MUKBANG ASMR,134210,153,1925,2023-06-13T12:49:22Z,집가락 정품 구매하는 곳 홍사운드몰 https://hongsound.shop/ 네이버 ...
5LIWLCJ_L3Y,구독자4명기념 불닭게티만들기#shorts,3208,15,43,2023-06-03T13:00:03Z,
HvQrkxSDXyk,불닭볶음면 200% 맛있게 먹기,740,1,15,2023-06-09T14:52:20Z,"shorts #불닭볶음면 #라이스페이퍼 #불닭라이스페이퍼쌈 #남매 이 콘텐츠는 인공지능 가상 연기자 서비스, 타입캐스트를 활용하여 ..."
6Sqt4gtOkuk,불닭 할라피뇨 치즈? 신상라면리뷰!,2890,3,56,2023-06-15T09:00:08Z,불닭 신제품? 불닭 + 할라피뇨 + 치즈 = 맛있다?!
s7Eb3L9vpD4,맛잘알들만 알고 있는 레시피로 만든 불닭볶음탕죽 속성 먹방🤤🤤,1036535,166,28503,2023-06-29T06:54:56Z,asmr #mukbang #먹방 #eatingsound.
I6jDhs3nPRI,불닭 유니버스 끝판왕🤤 Ultimate spicy noodle challenge🔥,1561,0,18,2023-06-02T11:34:29Z,nyumnyum #food #buldak #spicynoodles #fry #corncheese #recipe #콘치즈 #불닭볶음면 #튀김 #プルダックポックンミョン ...
j6c3ezP3uQg,삼양 불닭짬뽕과 진라면을 섞는다면? 무슨맛?~#shots,1041,2,9,2023-06-15T07:00:19Z,삼양불닭짬뽕#라면조합#혼밥 삼양 불닭짬뽕과 진라면을 섞는다면? 무슨맛?~
Gc4dR6N0bqA,할라피뇨 불닭볶음면 승선생 레시피 #koreanfood #요리 #요리브이로그 #불닭볶음면,719,3,7,2023-06-18T14:23:57Z,할라피뇨 불닭볶음면 승선생 레시피.
WnNwiKC8B9k,킬바사소시지 + 불닭볶음면 #shorts,4426,3,36,2023-06-17T08:40:06Z,불닭볶음면 #소세지 #라면 #라면먹방 #킬바사소시지.
r5CHfzv0x7g,독거총각 좋은소식 먹방 간단히 불닭볶음면에 선물고기1.5kg맵찔이는 슬퍼│Grilled meat and spicy chicken noodles Mukbang Eatingshow,245297,168,3736,2023-06-02T11:30:08Z,Notalking#Realsound#삼겹살먹방 문의는 아래 이메일과 카톡으로 연락주세요 ...
wXNtf_0iS60,점심은 불닭볶음탕면,4701,19,72,2023-06-15T12:50:01Z,불닭볶음면 #불닭먹방 #불닭소스 불닭볶음탕면: 1800원 Music provided by 브금대통령 Track : 코로 부는 리코더 ...
hLMpXRPPH4k,EAT BULDAK NOODLES WITHOUT CRYING PT. 2 | Let&#39;s H Mart | 불닭볶음면 더 맛있게 먹는 법 2편,1074,0,53,2023-06-17T14:00:33Z,"Corn Cheese Buldak Ramen, can you imagine a more beautiful thing? 🌶️   Corn cheese is a huge deal in Korea with so ..."
0bBFJx-vtyM,ASMR Celebrating Soupy Fire Noodles Re-release in Korea | Soft Boiled Eggs | Eating Sounds Mukbang,1170996,225,16138,2023-06-19T11:00:01Z,"HOW TO JOIN MINEE STARS STEP 1: Subscribe STEP 2: Turn on the notifications STEP 3: Comment ""joined"" ✨MINEE EATS ..."
_z3Q3gQnST4,할라피뇨치즈 불닭볶음면,479,0,5,2023-06-04T07:57:08Z,
S3NyRUz0lqw,잠든 일본인 남친 부모님 옆에서🤭몰래 불닭볶음면 먹방 ASMR 하숙집에 남친 초대 • 새벽 야식 • 일본인 남친 불닭먹은 반응...? 야끼소바불닭 후기! #한일커플 #국제커플,150136,306,3993,2023-06-27T11:15:23Z,Email → tacosama@dmil.kr Instagram → https://instagram.com/taco_sama_ bgm) Music provided by 브금대통령 Track ...
INQy4z8XDH8,불닭 치토스 치즈 튀김,497721,170,18393,2023-06-07T11:25:07Z,치토스를 묻히면 어떤 맛이게? #용디쇼츠.
_bOXp2lN-KY,혈관 터지는 맛.. | 대창 불닭 덮밥,591,0,16,2023-06-13T10:22:00Z,
AW9qbwAIe8A,신상! 불닭볶음탕면 리뷰! #불닭볶음탕면 #불닭 #shorts,1843,0,30,2023-06-29T09:00:05Z,
ZqWuzxk8-4k,#첫 먹방 #불닭 여러분은 가능??,381,6,-1,2023-06-12T13:49:34Z,
l8wNkAfReGY,로제불닭볶음면+사천짜파게티,308,0,7,2023-06-26T06:58:41Z,
dUw1W1GggaQ,밤10시에 짜장불닭먹는 담다미담 (과정이매우험난),52840,85,-1,2023-06-16T11:18:31Z,
pYSFZ-4xxT8,불닭 쿠지라이식,216490,48,6044,2023-06-23T10:00:41Z,맵찔이들도 먹을 수 있는 불닭 볶음면 쿠지라이식 불닭을 많이 맵게 느껴지는분들 많이 계시죠? 그런 분들을 위한 특급 레시피를 준비 ...
E4cVH8GDwxM,할라피뇨 치즈 불닭볶음면,714,0,14,2023-06-14T14:15:00Z,shorts #편의점 #불닭볶음면 #buldak #신상 #scoville #할라피뇨.
l77v3I6FElU,여름에도 역시 불닭이지,3256,4,50,2023-06-01T15:01:40Z,[ 불닭 냉면 ] 불닭 × 냉면 폼 미쳤당..!! 불닭볶음면 여름에는 이렇게 즐겨보세요 ❤️ 약간 송주불냉면 st도 느껴지고 불닭 특유의 ...
q_MZg3epZBA,불닭치즈김밥의 위험,2173,4,-1,2023-06-14T06:38:56Z,
l-2FJeCih6g,미고랭x불닭볶음면 케미 폭발! 동남아 현지 느낌 물씬~,4240,1,16,2023-06-24T10:30:20Z,ramen #buldak #migoreng #indonesianfood #koreafood #noodles #불닭볶음면 #라면 #рамен #mì #miinstan #ラーメン #ราเมน.
rGmsV5l5yEE,짝퉁불닭볶음면먹어보기,1108,4,8,2023-06-08T10:50:07Z,
NJxqefh7Ku4,불닭 어디까지 갈거니? (feat. 바질까지 간다) #쇼츠 #shorts #불닭볶음면,1676,1,25,2023-06-09T06:00:07Z,쇼츠 #shorts #불닭볶음면 안녕하세요? 오늘의 주제는 바질크림 불닭볶음면입니다. 다음 주제는 댓글로 남겨주세요. 그럼 이만.
y7hLGqCKw9A,"몸무게 앞자리를 바꿀 천재적 아이디어, 피자 불닭쌈 Pizza Buldak Ssam",16319084,2020,568777,2023-06-06T13:13:40Z,불닭볶음면 #불닭쌈 #피자 #buldak #ramen #spicynoodles #pizza #fyp #viral.
5LIWLCJ_L3Y,구독자4명기념 불닭게티만들기#shorts,3208,15,43,2023-06-03T13:00:03Z,
euw9p5z-vYI,"재출시라니 행복하닷❤️ 불닭볶음탕면에 수제비 넣고 각종 삼각김밥과 함께 먹방🌶️(ft.식혜) Buldak ramyun, sujebi, Kimbap, Sikhye Mukbang",104343,126,2634,2023-06-02T12:47:00Z,불닭볶음면먹방 #불닭볶음탕면먹방 #라면먹방 #김밥먹방 #삼각김밥먹방 #편의점먹방 0:00 요리하기 (Cooking) 2:36 메뉴소개 ...
KYke1IiVFfw,한국 불닭볶음면을 처음 먹어본 일본인이 놀란 이유,3467,10,158,2023-06-29T14:00:11Z,히키맨 #처음리뷰 #일본인 #히키코모리 #컨셉먹방 #캐릭터 #shorts.
6Sqt4gtOkuk,불닭 할라피뇨 치즈? 신상라면리뷰!,2890,3,56,2023-06-15T09:00:08Z,불닭 신제품? 불닭 + 할라피뇨 + 치즈 = 맛있다?!
I6jDhs3nPRI,불닭 유니버스 끝판왕🤤 Ultimate spicy noodle challenge🔥,1561,0,18,2023-06-02T11:34:29Z,nyumnyum #food #buldak #spicynoodles #fry #corncheese #recipe #콘치즈 #불닭볶음면 #튀김 #プルダックポックンミョン ...
Gc4dR6N0bqA,할라피뇨 불닭볶음면 승선생 레시피 #koreanfood #요리 #요리브이로그 #불닭볶음면,719,3,7,2023-06-18T14:23:57Z,할라피뇨 불닭볶음면 승선생 레시피.
hLMpXRPPH4k,EAT BULDAK NOODLES WITHOUT CRYING PT. 2 | Let&#39;s H Mart | 불닭볶음면 더 맛있게 먹는 법 2편,1074,0,53,2023-06-17T14:00:33Z,"Corn Cheese Buldak Ramen, can you imagine a more beautiful thing? 🌶️   Corn cheese is a huge deal in Korea with so ..."
WnNwiKC8B9k,킬바사소시지 + 불닭볶음면 #shorts,4426,3,36,2023-06-17T08:40:06Z,불닭볶음면 #소세지 #라면 #라면먹방 #킬바사소시지.
4DCQkpBGWRc,일찐 라이브 불닭볶음면 10초컷 도전먹방 #shorts feat.찐따제리얌,709632,310,22507,2023-06-02T07:21:43Z,
IDF-e1XXtsA,🔥불닭볶음탕면🔥,18697,13,-1,2023-06-12T08:30:05Z,food #foodie #shorts #간편레시피 #간편식 #요리 #간단요리 #자취요리 #1분요리 #shortsfood #りょうり #먹방 #foodstagram ...
