video_id,title,rating_view,rating_comments,rating_good,published_date,description
wzTRGCuKYH8,"먹방 브이로그ㅣ빽보이 콘치즈피자, 불닭볶음면, 쿠티크 트러플파스타, 청년다방 감자돌이떡볶이, 편의점신상, 열무비빔밥, 통스팸구이, 노랑통닭 청양치킨, 눈꽃치즈떡볶이, 빅컵누들",7585,38,99,2023-06-11T12:00:42Z,"먹방브이로그 #브이로그 #이지민 여러분 한주 잘보내셨나요~~? 와,, 날씨 진짜 너무너무 덥죠,,, 이 더위에 제가 감기가 걸렸었다는…"
2-AYKqR25cQ,"SPICY EATING SHOW,EAT FIRE NOODLE 불닭 짜슐랭 쭈꾸미 스팸 먹방",12,0,0,2023-06-13T13:15:35Z,ASMR #MUKBANG | BLACK BEAN FIRE NOODLE & SPICY OCTOPUS SPAM FRIED DUMPLING EATING 불닭 짜슐랭 쭈꾸미 ...
jEnDwMXGt9E,ASMR MUKBANG_ 직접 만든 불닭 짜장 버섯 양념치킨 소세지 먹방 _ 레시피,25,0,2,2023-06-18T13:20:54Z,
PuseHEryVS4,ASMR MUKBANG| 직접 만든 불닭 버섯 소세지 먹방 &amp; 레시피 FRIED SAUSAGES AND FIRE NOODLES EATING,853799,325,10471,2023-06-30T12:30:19Z,먹방 #ASMR #MUKBANG #불닭버섯 #킬바사소시지 ❤SULGIES❤ 가입하기 ...
RZh89YW3VuM,ASMR MUKBANG | 반숙계란 불닭볶음탕면 먹방 재출시 기념🔥🥚맛있어서 또 먹었습니다! SPICY FIRE NOODLES SOUP &amp; SOFT BOILED EGG EATING,5541,15,180,2023-06-23T12:00:16Z,"ASMR MUKBANG | SOUPY FIRE NOODLES *SOFT BOILED EGGS, DUMPLINGS EATING SOUNDS 불닭볶음탕면 *반숙계란 만두 ..."
2MDA_0cqZ78,리얼가족먹방:)불닭팽이버섯 불막창&amp;소막창에 막걸리 마시는 가족 일상 먹방😋ㅣSpicy Makchang &amp; Spicy Enoki MushroomㅣMUKBANGㅣEATING SHOW,202512,219,5119,2023-06-08T11:00:02Z,불닭팽이버섯 #막창 #막걸리 ☆일상과 요리/daily life & cooking 00:11 ~ 03:55 먹방시작/Start eating 03:59 ~ ☆ 오늘은 아들 ...
kYJhzH-XsL4,불닭 마라 납작당면 먹방 🫢 | Buldak Mala Noodles (so spicy omg!) #먹방,1763,0,28,2023-06-23T10:49:34Z,So spicy but so yummy! #shorts.
TrAlDxmMO60,ASMR MUKBANG| 직접 만든 불닭 짜장 버섯 양념치킨 소세지 먹방 &amp; 레시피 FRIED CHICKEN AND FIRE NOODLES EATING,1,0,0,2023-06-16T09:16:58Z,Thank you for watching the video today! It is even more fun to watch subtitles!   Hello! A Eat food and BBQ full of delicious food!
F6GbEfh1n_E,ASMR MUKBANG 직접 만든 타키스 대왕 가래떡 떡볶이 불닭볶음면 치즈스틱 핫도그 먹방 &amp; 레시피 FIRE NOODLES AND Tteokbokki EATING SOUND!,2812147,419,16663,2023-06-13T13:15:00Z,오늘은 보라색 타키스 시즈닝 만들기 입니다. 재밌게 봐주세요^^ 시오 구독하기   https://goo.gl/azcgUX 시오 인스타그램   ...
DB3LzK1F-mo,ASMR MUKBANG| 직접 만든 불닭 짜장 버섯 양념치킨 소세지 먹방 &amp; 레시피 FRIED CHICKEN AND FIRE NOODLES EATING,0,0,0,2023-06-12T10:36:56Z,Thank you for watching the video today! It is even more fun to watch subtitles!   Hello! A Eat food and BBQ full of delicious food!
_CaF63vehlA,직접 만든 불닭 버섯 불닭쌈 양념치킨 소세지 먹방 &amp; 레시,4,0,0,2023-06-01T16:37:32Z,
jZ3Bw7rCe6Y,ASMR MUKBANG| 직접 만든 불닭 짜장 버섯 양념치킨 소세지 먹방 &amp; 레시피 FRIED CHICKEN AND FIRE NOODLES EATING,0,0,0,2023-06-15T10:13:48Z,Thank you for watching the video today! It is even more fun to watch subtitles!   Hello! A Eat food and BBQ full of delicious food!
jqd4G_8lQlo,ASMR MUKBANG| 직접 만든 불닭 짜장 버섯 양념치킨 소세지 먹방 &amp; 레시피 FRIED CHICKEN AND FIRE NOODLES EATING,8,0,0,2023-06-15T10:21:12Z,Thank you for watching the video today! It is even more fun to watch subtitles!   Hello! A Eat food and BBQ full of delicious food!
qI99Yhlm4H4,3편 족발보쌈불닭  #다이어트 #스리랑카여자 #외국인 #trending #자기관리 #운동하는여자#먹방 #먹방브이로그,503,2,16,2023-06-20T14:32:32Z,
ar48ltIaok4,ASMR MUKBANG| 직접 만든 불닭 짜장 버섯 양념치킨 소세지 먹방 &amp; 레시피 FRIED CHICKEN AND FIRE NOODLES EATING,1,0,0,2023-06-18T09:53:01Z,Thank you for watching the video today! It is even more fun to watch subtitles!   Hello! A Eat food and BBQ full of delicious food!
MGN-y8rJoRM,바삭한 대창과 매콤한 불닭 그리고 파김치🌱,67099,20,1748,2023-06-07T14:49:22Z,shorts #먹방asmr #대창 #재창먹방 #붉닭볶음면 #불닭볶음면먹방 #파김치 #파김치먹방.
W2GBs3ywW3I,🔴요즘 핫한 불그리라면에 바삭 구운 통대창 먹방!🔥 불닭볶음면 너구리 레전드 꿀조합 리얼사운드 Tripes &amp; Ramyeon Mukbang Asmr #266,243,0,1,2023-06-16T04:43:41Z,요즘 핫한 불그리라면에 바삭 구운 통대창 먹방!   불닭볶음면 너구리 레전드 꿀조합 리얼사운드 Tripes & Ramyeon Mukbang Asmr ...
yUMkoaMoEtA,취두부 홍어 두리안 낫또 불닭볶음면으로 철판아이스크림 만들기,38648,154,674,2023-06-10T11:40:00Z,최도전 #철판아이스크림 #먹방 취두부 홍어 두리안 낫또 불닭볶음면으로 철판아이스크림을 만들어먹어보았다!!!!
WbcV_l3XSjQ,"[먹방브이로그#74] 새벽 2시반에 가족들 몰래 치킨 뜯기 🌚🍗 두루치기,모듬초밥,우동,츄러스1500,bhc맛초킹,불닭,뿌링치즈볼,엽떡,계란야채죽",1285755,508,9014,2023-06-27T14:23:27Z,"업로드 주기는 5~10일이며, 열흘 이상 소요될 경우 커뮤니티나 고정댓글로 공지드립니다. ☑️욕설, 허위사실, 싸움조장 댓글은 ..."
qI99Yhlm4H4,3편 족발보쌈불닭  #다이어트 #스리랑카여자 #외국인 #trending #자기관리 #운동하는여자#먹방 #먹방브이로그,503,2,16,2023-06-20T14:32:32Z,
UvM4kqlWDd8,Korea Convenience Store Pink Food Mukbang 핑크 먹방 편의점 불닭볶음면 HACO 하코,154235,12,4193,2023-06-24T12:43:44Z,"영블리의 편의점 핑크 먹방 ~! youngvely's convenience store pink mukbang ~! Pink fire spicy noodles, tteokbokki, pink donuts, pink ..."
ar48ltIaok4,ASMR MUKBANG| 직접 만든 불닭 짜장 버섯 양념치킨 소세지 먹방 &amp; 레시피 FRIED CHICKEN AND FIRE NOODLES EATING,1,0,0,2023-06-18T09:53:01Z,Thank you for watching the video today! It is even more fun to watch subtitles!   Hello! A Eat food and BBQ full of delicious food!
MGN-y8rJoRM,바삭한 대창과 매콤한 불닭 그리고 파김치🌱,67099,20,1748,2023-06-07T14:49:22Z,shorts #먹방asmr #대창 #재창먹방 #붉닭볶음면 #불닭볶음면먹방 #파김치 #파김치먹방.
DEwZb8bZNQs,ASMR MUKBANG| 직접 만든 불닭 짜장 버섯 양념치킨 파김치 먹방 &amp; 레시피 FRIED CHICKEN AND FIRE NOODLES EATING,3997265,652,22431,2023-06-05T12:30:05Z,"먹방 #ASMR #MUKBANG #짜장불닭버섯 합동 방송 및 광고, 협찬 문의는 아래 메일로 연락해주세요 :) 비즈니스메일 ..."
AdZzrWpu5Tk,ASMR MUKBANG| 직접 만든 불닭 떡볶이 치즈볼 소세지 먹방 &amp; 레시피 CHEESE BALL AND Tteokbokki EATING,2252989,577,18937,2023-06-21T12:30:07Z,"먹방 #ASMR #MUKBANG #불닭볶음탕면 #떡볶이 합동 방송 및 광고, 협찬 문의는 아래 메일로 연락해주세요 :) 비즈니스메일 ..."
67G4aTdKwfc,짜장불닭먹으려다가 팬분들 만난 담다미다,13603,12,-1,2023-06-18T09:34:31Z,
dzxFxvN4-1c,불닭짬뽕 이것을 넣어라 #짬뽕 #라면 365 라면먹기 #라면 #ramen #라면레시피 라면 맛있게 끓이는 방법,176,0,3,2023-06-25T13:10:01Z,불닭짬뽕 국물 맛을 맛있게 만드는 비법 #라면레시피#라면추천#라면레시피 【Facebook】 ...
ftEsaIw28tg,ASMR MUKBANG| 직접 만든 불닭볶음면 양념치킨 소세지 먹방 &amp; 레시피 FRIED CHICKEN AND FIRE NOODLES EATING,179,0,323,2023-06-28T00:59:17Z,ASMR MUKBANG| 직접 만든 불닭볶음면 양념치킨 소세지 먹방 & 레시피 FRIED CHICKEN AND FIRE NOODLES EATING.
QP8akl1zLtE,cook with me ★ 골뱅이 불닭 콘치즈 레시피,73,6,11,2023-06-27T00:15:19Z,광고 #미셸TV #혼술안주 #안주추천 #골뱅이 #골뱅이불닭콘치즈 #유동골뱅이 #골뱅이요리 #골뱅이레시피 #통조림골뱅이 #요리 ...
_JgHI8jY76U,Mukbang ASMR #Shorts :) Pork Cutlet &amp; Fire Noodles Eating 돈까스 불닭볶음면 먹방!,239829,51,10750,2023-06-26T13:40:00Z,shorts #mukbang #asmr Chihun ASMR Full Video Link - https://youtu.be/Uj2Xc3yJhTk Mail : asmr.chihun@gmail.com ...
4cJHnxeJb4k,요즘 핫한 불그리라면에 바삭 구운 통대창 먹방!🔥 불닭볶음면 너구리 레전드 꿀조합 리얼사운드 Tripes &amp; Ramyeon Mukbang Asmr,259050,9,828,2023-06-13T21:04:23Z,요즘 핫한 불그리라면에 바삭 구운 통대창 먹방!   불닭볶음면 너구리 레전드 꿀조합 리얼사운드 Tripes & Ramyeon Mukbang Asmr.
csmL5vp63GM,요즘 핫한 불그리라면에 바삭 구운 통대창 먹방!🔥 불닭볶음면 너구리 레전드 꿀조합 리얼사운드 Tripes &amp; Ramyeon Mukbang Asmr,1724,0,407,2023-06-12T02:28:19Z,요즘 핫한 불그리라면에 바삭 구운 통대창 먹방!   불닭볶음면 너구리 레전드 꿀조합 리얼사운드 Tripes & Ramyeon Mukbang Asmr.
Ekfu-KtIfww,먹방 브이로그) 우울할땐 혼자 장도보고 불닭도 먹고 고기도 먹어야한다..! (슈바인학센/불닭볶음면/짜장면/수육/혼술/와인/회/해산물/치즈/파리바게트/빵/장보기),180,3,6,2023-06-11T09:00:05Z,인스타-orphic_mn #행복 #우울증 #우울증극복 #불닭볶음면 #슈바인학센 #치즈 #쌈 #고기 #장보기 #빵 #파리바게트 #디저트 ...
_2Ilz-fb_AQ,탈모노총각의 불닭 소스 라볶이 기본 레시피(임창정 소주 한 잔),687,3,-1,2023-06-21T10:04:09Z,탈모노총각 #불닭소스 #라볶이 #먹방 #소주한잔 #임창정 #노래방 #혼술 #혼밥.
sNy9iyKJ-CI,ASMR MUKBANG| 직접 만든 불닭 짜장 버섯 양념치킨 소세지 먹방 &amp; 레시피 FRIED CHICKEN AND FIRE NOODLES EATING,0,0,0,2023-06-11T12:41:52Z,Thank you for watching the video today! It is even more fun to watch subtitles!   Hello! A Eat food and BBQ full of delicious food!
_SrvX-WLxOg,만약에 불닭볶음면 애인과 사귄다면?🔥🐔,247,1,12,2023-06-25T09:57:04Z,
dMp8ClJ2bdQ,ASMR MUKBANG| 직접 만든 불닭 짜장 버섯 양념치킨 소세지 먹방 &amp; 레시피 FRIED CHICKEN AND FIRE NOODLES EATING,10,0,0,2023-06-07T13:29:49Z,Thank you for watching the video today! It is even more fun to watch subtitles!   Hello! A Eat food and BBQ full of delicious food!
kihAASVzsYQ,ASMR MUKBANG| 직접 만든 불닭 짜장 버섯 양념치킨 소세지 먹방 &amp; 레시피 FRIED CHICKEN AND FIRE NOODLES EATING,2,0,0,2023-06-17T11:55:09Z,Thank you for watching the video today! It is even more fun to watch subtitles!   Hello! A Eat food and BBQ full of delicious food!
e04pJpwr48k,먹방~치즈 불닭비빔밥#shorts#먹방,149,2,4,2023-06-28T05:51:05Z,
SUar3n0fjSs,카레불닭+치킨너겟+햄버거,915,0,14,2023-06-02T02:57:46Z,
1H7IWW8QeR4,불닭볶음탕면 먹방!,41,-1,5,2023-06-19T06:39:43Z,
5Xq6EoFdYOM,ASMR MUKBANG| 직접 만든 불닭 짜장 버섯 양념치킨 소세지 먹방 &amp; 레시피 FRIED CHICKEN AND FIRE NOODLES EATING,1,0,0,2023-06-18T09:52:22Z,Thank you for watching the video today! It is even more fun to watch subtitles!   Hello! A Eat food and BBQ full of delicious food!
YVSzoF9CcNI,요즘 핫한 불그리라면에 바삭 구운 통대창 먹방!🔥 불닭볶음면 너구리 레전드 꿀조합 리얼사운드 Tripes &amp; Ramyeon Mukbang Asmr,1667,0,325,2023-06-27T04:16:28Z,요즘 핫한 불그리라면에 바삭 구운 통대창 먹방!   불닭볶음면 너구리 레전드 꿀조합 리얼사운드 Tripes & Ramyeon Mukbang Asmr.
1Ip2jBNnTzk,ASMR MUKBANG| 직접 만든 불닭 짜장 버섯 양념치킨 소세지 먹방 &amp; 레시피 FRIED CHICKEN AND FIRE NOODLES EATING,2,0,0,2023-06-16T09:36:11Z,Thank you for watching the video today! It is even more fun to watch subtitles!   Hello! A Eat food and BBQ full of delicious food!
ot_DXtuLXcw,탕후루의 달인 🏅 탕후루를 만드는 초보 중수 고수의 비법! #shorts,4087506,848,94279,2023-06-17T02:25:54Z,탕후루 #비법 #꿀팁.
L6TOSYtENOg,ASMR - Buldak  Noodles and Birria Pie🔥🔥 바질크림 불닭우동 l 로제 불닭납장당면 l 피자 치즈볼ㅣ미국식 비리아 타코🌮,490,0,25,2023-06-11T14:32:19Z,Today's Mukbang Buldak Rose Noodles Buldak Basil Cream Noodles Birria Taco Pie Pizza Cheese Balls 바질크림 불닭우동 ...
QFjUN96__VE,[ASMR] 🔥재출시한 ‘불닭볶음탕면’ 🐣반숙란 넣어서 먹방! &quot;Buldak-bokkeum-tang-myeon&quot; 🐣 Half-boiled egg MUKBANG,2195,8,54,2023-06-19T03:00:08Z,불닭볶음탕면 #재출시 #먹방 자막을 켜주세요~ Please turn on the captions~ キャプションをオンにしてください~ 먹고싶은거 다 ...
aWcDtQgD2ds,CHRISTMAS PINK ASMR MUKBANG 직접 만든 불닭 버섯 불닭쌈 양념치킨 소세지 먹방 &amp; 레시 FRIED CHICKEN AND FIRE NOODLES EATING,16,0,-1,2023-06-01T15:49:33Z,
CixeuFEuocw,🍲TRYING 불닭 떡볶이🍲 #viral #explore #trending #shorts #떡볶이 #koreanfood #korea #mukbang,537,0,9,2023-06-05T08:37:21Z,
YVWW5B6BIXg,요즘 핫한 불그리라면에 바삭 구운 통대창 먹방!🔥 불닭볶음면 너구리 레전드 꿀조합 리얼사운드 Tripes &amp; Ramyeon Mukbang Asmr,13774,0,426,2023-06-27T20:00:43Z,요즘 핫한 불그리라면에 바삭 구운 통대창 먹방!   불닭볶음면 너구리 레전드 꿀조합 리얼사운드 Tripes & Ramyeon Mukbang Asmr.
WinMnyUQYOA,ASMR 바질크림불닭우동 먹방 BASIL CREAM BULDAK UDON NOODLES MUKBANG / EATING SOUNDS #shorts,894,3,32,2023-06-05T12:00:31Z,asmr #asmrsounds #asmreating #mukbang #eating #eatingshow #eatingsounds #먹방 #koreanfood #noodles #firenoodles ...
jZafkyDYMFs,호미 불닭/오돌뼈/주먹밥/계란찜/쿨피스/소주/청하/맥주 #hope #가족 #life #감사합니다 #호미 불닭 #오돌뼈 #먹방 #매운맛 #술,279,0,6,2023-06-02T10:01:00Z,
E3ZLRviyG7Y,ASMR MUKBANG 직접 만든 치토스 햄버거 치즈스틱 불닭볶음면 핫도그 먹방 &amp; 레시피 FIRE NOODLES AND BURGER EATING SOUND!,12851016,1739,77040,2023-06-07T13:00:09Z,먹방 #ASMR #MUKBANG 안녕하세요 맛있는 음식이 가득한 공삼테이블입니다! ✉비지니스 메일 : gongsam203@gmail.com ...
8jACQ5lepCA,"#불닭볶음탕면 먹방보다가 밤샌사람🙃 배고파져서 잠옷바람으로 온동네를 뒤졌는데 어디에도 없음,,, 빡쳐서 4번들시켜버림🤪(쿠팡같은 곳에서도 안팔고 삼양공식몰에서만 세트로 팜😡)",802,0,5,2023-06-13T21:08:12Z,
SFRTwGAMuJQ,매운불닭 5개 푸파미션 #불닭 #챌린지 #푸파 #오기 #꺄르르 #장마 #7월,871,3,7,2023-06-29T18:56:57Z,불닭 5개 12분안에 클리어 미션~~ 해봄? 흐앙~ㅠ 아깝게 실패ㅠ #소통 #엽기 #섹시 #먹방 #야방 -비즈니스문의▷1:1 오픈카톡▷오리 ...
yki9GCT1tQU,"먹방 브이로그ㅣ호식이 요거치즈닝, 마늘떡볶이, 불닭볶음면, 홍대쭈밥, 순대, 나물비빔밥, 피자스쿨 불닭고구마피자, 오븐스파게티, 닭강정, 콩국수, 실비김치, 불낙볶음, 약과도넛",6887,35,93,2023-06-25T12:00:43Z,먹방브이로그 #브이로그 #이지민 여러분 한주 잘보내셨나요~~? 믿기지 않는 사실 하나!!!!!!!!!! 이번 영상이 6월의 마지막 영상이라는 ...
-2BoL98VWgU,ASMR MUKBANG 직접 만든 핑크 대왕 타키스 불닭볶음면 치즈스틱 핫도그 먹방 &amp; 레시피 FIRE NOODLES AND Tteokbokki EATING SOUND!,2148946,332,16481,2023-06-17T13:15:00Z,오늘은 핑크음식 먹방 입니다. 재밌게 봐주세요^^ 시오 구독하기   https://goo.gl/azcgUX 시오 인스타그램   ...
gyXzJBkATzU,ASMR MUKBANG| 직접 만든 불닭 짜장 버섯 소세지 먹방 &amp; 레시피 FRIED SAUSAGES AND FIRE NOODLES EATING,1769905,538,15539,2023-06-23T12:30:30Z,먹방 #ASMR #MUKBANG #짜장불닭버섯 ❤SULGIES❤ 가입하기 ...
AakZN4ZV8Jw,ASMR MUKBANG | 편의점 직접 만든 불닭볶음면 햄버거 김밥 디저트 먹방 &amp; 레시피 FRIED CHICKEN AND Tteokbokki EATING,1795710,320,20470,2023-06-29T13:15:00Z,오늘 영상도 재밌게 봐주세요!! 시오 구독하기   https://goo.gl/azcgUX 시오 인스타그램   https://www.instagram.com/sio_yo/ ...
AV2AGD6drHs,요즘 핫한 불그리라면에 바삭 구운 통대창 먹방!🔥 불닭볶음면 너구리 레전드 꿀조합 리얼사운드 Tripes &amp; Ramyeon Mukbang Asmr,145,0,1,2023-06-17T22:00:52Z,요즘 핫한 불그리라면에 바삭 구운 통대창 먹방!   불닭볶음면 너구리 레전드 꿀조합 리얼사운드 Tripes & Ramyeon Mukbang Asmr.
xvtc2RTdh1c,요즘 핫한 불그리라면에 바삭 구운 통대창 먹방!🔥 불닭볶음면 너구리 레전드 꿀조합 리얼사운드 Tripes &amp; Ramyeon Mukbang Asmr,967,0,0,2023-06-12T06:50:18Z,요즘 핫한 불그리라면에 바삭 구운 통대창 먹방!   불닭볶음면 너구리 레전드 꿀조합 리얼사운드 Tripes & Ramyeon Mukbang Asmr.
9hX1YF4x3zI,이번 생 게장은 이거로 종결합니다.,597421,361,6896,2023-06-16T08:27:46Z,
iXKs372MKxs,생라면 먹방 처음해봄🤗신라면 불닭볶음면 진라면 사리곰탕 너구리 짜파게티 오도독 오도독 라면먹방🤩 Ramen Real Sound Mukbang asmr,3670,23,-1,2023-06-11T10:00:36Z,라면먹방 #생라면먹방 #먹방 오늘의 메뉴 - 신라면 불닭볶음면 진라면 사리곰탕 너구리 짜파게티 - 자막 원하시면 유튜브 자막으로 켜 ...
eHxVO6dVgYE,클레버 멤버들의 좋아하는 음식 먹방! 최근에 자주 먹는 음식을 소개합니다❤️ 멤버들마다 다양한 음식에 꽂혀 있네요!ㅋㅋ ｜클레버TV,166316,93,1330,2023-06-09T08:00:16Z,_ 여러분들은 요즘 어떤 음식을 가장 많이 드시나요? 댓글로 남겨주세요^^ 클레버TV 아카데미 오디션 지원 ...
TaWel_K3Oq4,당면 가득 칼칼한 소불고기전골 불닭마요계란말이 오이무침 요리 먹방 Bulgogi Egg roll Cucumber Kimchi Koreanfood Mukbang,145994,79,2927,2023-06-15T11:00:20Z,당면 가득 칼칼한 소불고기전골 불닭마요계란말이 오이무침 요리 먹방 Bulgogi Egg roll Cucumber Kimchi Koreanfood Mukbang 소 ...
45UaeoJHq8M,[먹방브이로그#77] 불닭볶음탕면이라니..🥹(주먹밥 김치찌개 계란말이 꽈배기 고로케 핫도그 떡갈비 돈까스 오!맵김치 ),7853,7,-1,2023-06-26T12:31:13Z,장마가 시작된걸 보니 여름이네요   ❣️식도락마켓 오!맵김치❣️ https://m.smartstore.naver.com/sicdorak57?
B6cwqGnAi7k,실제상황! 비행기가 너무 흔들려서 추락할거 같아요ㅠㅠ 라면 다 넘치고... 공포증 생긴 이유? 흔한 가족 일상 | 말이야와친구들,259776,143,2243,2023-06-03T23:15:00Z,드디어 한국 오는 날! 공항에서 자고... 비행기를 탔는데 라면 다 넘칠정도록 흔들려요ㅠㅠ 공포증이 생긴 이유? #말이야와친구들 ...
z7kjcF85qjA,Korean Spicy fire noodles buldak ramyeon,4844,2,142,2023-06-20T11:00:52Z,korean spicy noodles buldak ramyeon.
-XlFM0YSWZk,외국 SNS에서 핫한 우동 레시피,79341,29,1644,2023-06-14T08:00:00Z,"대패볶음우동을 만들어 보자 [재료] 대패삼겹살 150g, 우동면, 대파, 청경채, 숙주 [만드는 법] 1. 우동면과 청경채는 뜨거운 물에서 한번 ..."
dfbwU-Hbwvs,이거 진짜 촉감이좋아요..🫢 도안있음! Mini Korean ice cream (Free Printable),1382718,470,43950,2023-06-10T02:00:13Z,
FcV1FjifGkc,핑크 편의점 음식 먹방 🌸 로제 불닭 &amp; 떡볶이 디저트 먹방 Korean Convenience Store Food Ramen Desserts Mukbang ASMR Ssoyoung,4632812,900,44425,2023-06-07T09:00:13Z,Convenience_store #KoreanMukbang #Mukbang #Best #Reaction #Ssoyoung #Eatingsound #asmr 오늘도 쏘영이의 영상을 시청 ...
Vo9ph0uXrxQ,바삭한 자이언트 통닭다리와 매콤한 까르보나라 불닭볶음면 먹방~!! 리얼사운드  ASMR Mukbang(Eating Show),280414,121,4284,2023-06-22T12:00:31Z,광고문의 opklrnr0@nate.com 오늘은 자이언트 통닭다리와 까르보나라 불닭볶음면을 준비했어요! 통닭다리는 겉은 바삭하고 속은 ...
2uFo7JXS1nk,낭만이 &quot;이 키트&quot; 만 사용하는 이유... [로블록스 배드워즈],260278,346,1671,2023-06-04T02:19:38Z,디스코드 : https://discord.gg/r5pMQHGYEK ○ 로블록스 프로필 : https://www.roblox.com/users/192150136/profile ○ 로블록스 그룹 ...
8bJb5Q54NL4,British Uni Students get a job at a Korean Convenience Store!,3345627,2237,126941,2023-06-03T11:30:04Z,"After trying almost every snack they sell, we surprised Armand and Max with the news that like a true student they are going to get ..."
V47n5175ldM,"요즘 핫한🔥6월 편의점 신메뉴리뷰🧃 하얀짜파게티,트러플라면,왕돈까스,할라피뇨불닭,실비김치,약과도넛,민초바나나킥,연세티라미수컵,닭갈비전 등등💚",328395,143,4188,2023-06-07T10:31:21Z,채널구독 Subscribe - http://bit.ly/1NhqAO6 ❤ instagram - https://instagram.com/sini_ck ❤멤버십 가입 ...
EAhtDS2wI5Y,วิธีทิ้งขยะเจ๋งๆของเอวา #เอวา #mymatenate,766272,131,38827,2023-06-17T06:50:31Z,
Zk9bUYCUpio,لقيت عندي اخت تؤام من الصين 😍😂,5539908,351,126451,2023-06-14T18:00:23Z,
bWEqja6IXok,결혼식 때 낸 축의금 돌려준대,2318790,734,20918,2023-06-19T09:00:19Z,2033년#스케치코미디#이혼 안녕하세요. 이번 에피소드는 2033년에 벌어지는 좌충우돌 우당탕탕 '이혼식'편입니다.^^ 재미있게 ...
-opAuRBqlXg,오늘은 콩국수 먹방 김치가 미쳐떠요👍👍,134,1,1,2023-06-01T08:00:52Z,
HTtdoElOmGA,"동에서 먹고 서에서 먹고ㅣ먹방브이로그ㅣ카페혜야,청년다방 차돌떡볶이,닭가슴살 김치찜,그래놀라 만들기,할라피뇨불 닭볶음면,박가네항정껍데기,짱이네떡볶이,나드리쫄면,유부초밥",173,0,2,2023-06-11T08:59:15Z,요즘 먹은 것들.
fnBipq7ULSA,사장님 뭔가 웃기심ㅋㅋㅋㅋ #shorts,323449,53,5477,2023-06-02T15:00:35Z,슈화 K알바 체험기 목요일 저녁 7시 [워크맨] 채널에서 확인! #워크돌 #알바 #직업 #리뷰 #슈화 #예슈화 #workdol #kjob #shuhua ...
YtzLW-O9vSI,툰알못들이 웹툰 제목만 듣고 내용 유추하는 영상ㅋㅋㅋㅋㅋㅋ,198696,208,3470,2023-06-17T09:00:17Z,에라이 #웹툰 #토크 #병맛 팬카페 - https://cafe.naver.com/teamerai 그림 - 앱꽁 @Ekkong0000.
CbZfwvH1Lw4,시골치매가족먹방엄마아들(양배추닭고기덮밥&amp;Cabbage Chicken Rice Bowl)요리 먹방 mukbang eating show,1028,20,59,2023-06-05T03:59:59Z,양배추닭고기덮밥 #Cabbage Chicken Rice Bowl #시골가족 #치매가족 음악 노래 No.9 Esther's Waltz 아티스트 Esther Abrami 앨범 ...
wfWC9mKFaOI,시골치매가족먹방엄마아들(볶음간짬뽕&amp;Stir-fried Ganjamppong)요리 먹방 mukbang eating show,1117,14,57,2023-06-23T10:00:35Z,볶음간짬뽕 #Stir-fried Ganjamppong #시골가족 #치매가족 음악 노래 No.9 Esther's Waltz 아티스트 Esther Abrami 앨범 No.9 ...
-UzB_lAvSVo,시골치매가족먹방엄마아들(닭고기쌈장덮밥&amp;Chicken Ssamjang Rice Bowl)요리 먹방 mukbang eating show,780,8,41,2023-06-26T08:56:05Z,닭고기쌈장덮밥 #Chicken Ssamjang Rice Bowl #시골가족 #치매가족 음악 노래 No.9 Esther's Waltz 아티스트 Esther Abrami 앨범 ...
D1tutgZ-J3w,DIBENERIN KOK TAMBAH BIKIN EMOSI | MOD GUTS AND GLORY #19 [GAMPLAK],84913,263,4705,2023-06-08T12:16:17Z,Join KoalaBro: http://bit.ly/KoalaBro Subscribe juga ke channel SharkPo: http://bit.ly/SharkBro • Second Channel: ...
y1eG7Cc2ecQ,시골치매가족먹방엄마아들(닭죽&amp;chicken porridge)요리 먹방 mukbang eating show,980,10,54,2023-06-21T08:41:21Z,닭죽 #chicken porridge #시골가족 #치매가족.
K2gwdb6Cfnc,맛잘알들만 아는 &quot;이 치킨&quot; 미만 잡,349455,62,5245,2023-06-02T11:28:24Z,shorts #교촌치킨 #또래오래 #갈반핫반 #갈릭반핫양념반.
